Sender,DmContent,AppearTime,SendTime,FontColor,DmType
54ecd657,他的裤子不是阔腿就是紧身,908.861,1611055913,16777215,1
5865cc6e,我也不喜欢和亲戚打招呼，每次都被我妈说哎真的不喜欢,2195.219,1611055915,16777215,1
9cef7445,别期待对方会改变人一旦希望对方为自己做出什么改变这段关系就该终止了,3859.061,1611055938,16777215,1
6c247f6e,男的应该还有其他毛病比如女性朋友很多,3080.034,1611055942,16777215,1
958c6ddc,这个兄弟真的太搞笑了,226.719,1611055947,16777215,1
d21e2be4,妈也是一副不相信的脸色,4438.811,1611055954,16777215,1
5504a05,结论是这个男的不行,3051.391,1611055967,16777215,1
56daf5d7,姐人间清醒！,4213.977,1611055974,16777215,1
51c1e013,唉。原生家庭,3941.319,1611055978,16777215,1
e9c5b660,揣着明白装糊涂,2573.769,1611055989,16777215,1
b5b3533c,爸原地戴上了光环,3024.351,1611055996,16777215,1
72050a0b,被骂怕了这一期拼命找补,3211.645,1611055998,16777215,1
74939d87,你希望他们好就别那么刁难女方啊，每天纠结礼节问好什么的,2981.409,1611056000,16777215,1
6c247f6e,女生应该不爱这个男的但为了孩子可能会复合,3162.102,1611056007,16777215,1
935cf67,笑死用嘴一针见血,2604.491,1611056042,16777215,1
c6e4bbfb,活该被骂，这不是传统，是迂腐,2185.136,1611056049,16777215,1
e4ff5a98,唉，烤肉应该在她俩中间做调和，而不是说这些伤人的话。,3027.599,1611056055,16777215,1
39d0053f,听下来感觉他爸不是问题了，他才是问题,3275.465,1611056056,16777215,1
e8e3b1a3,前面那位就无语咋就跟女的讲不通道理了呢,2579.849,1611056069,16777215,1
1b9380e7,他们离婚真的只是因为这个？,2886.403,1611056072,16777215,1
e9c5b660,呵，这说的。,2713.019,1611056101,16777215,1
958c6ddc,这两个真的是完全不一样,416.171,1611056106,16777215,1
f4654bf,男的是想表达他可以做家长，希望父亲不干涉他们吧,2928.596,1611056114,16777215,1
267fa339,这男的把他爸和荷叶都伤了，一箭双雕,2800.592,1611056114,16777215,1
35103773,现在又来甩锅自己爹虽然爹不是什么好东西,2176.174,1611056130,16777215,1
db9ff5d9,后面书架上是家庭医学大辞典吗,2253.994,1611056144,16777215,1
96bfd96c,是，你什么都怪南方，你当然不认为女方又错了,3286.359,1611056172,16777215,1
e9c5b660,现在是把错都归到女方了吗？因为结婚用钱地方多，女生不讲理，还因为给父亲钱吵架？！,2737.001,1611056177,16777215,1
b5b3533c,恶评对爸起了作用哈,3212.668,1611056184,16777215,1
11372879,公是觉得荷叶没礼貌是吧,3217.947,1611056184,16777215,1
935cf67,无语了,2831.846,1611056197,16777215,1
11372879,韩国确实比较注重这些，特别是老一辈的,3228.553,1611056208,16777215,1
e4ff5a98,烤肉就应该扮演第三方，多讲彼此的好，这样公和荷叶才能越来越好,3118.399,1611056208,16777215,1
5504a05,男的就嘴上说的好听,3282.9,1611056213,16777215,1
f4654bf,他爸垫了那么多钱，结果两夫妻都不问候关心，才有那么多事,2965.972,1611056213,16777215,1
ee301336,说实话如果他爸当时真的什么都不为他做他现在肯定也会怨恨他爸不为他做啊,2878.257,1611056222,16777215,1
96bfd96c,你结婚了么？你见你公就不说话么？那你见邻居会喊大叔么？,3289.843,1611056228,16777215,1
56b1366a,是的，不然这2亿要被他爸抓着说一辈子,2838.977,1611056234,16777215,1
c6e4bbfb,替爷说话的那个，如果你公骂你爹妈，你能不生气？,2213.353,1611056238,16777215,1
d37e9ab4,感谢这个幼儿园,1735.919,1611056241,16777215,1
35103773,呵自己教的儿子不也是这样,2307.263,1611056261,16777215,1
ee301336,这男的啥脑子服了一句话让他爸心寒到底了,2881.929,1611056262,16777215,1
11372879,对老一辈的来说，这对夫妻真的很没礼貌,3282.319,1611056262,16777215,1
39ed124b,这个男的真的不行,2863.33,1611056272,16777215,1
b5b3533c,你们这帮狗女犬，她俩复婚是一定的了,3304.228,1611056276,16777215,1
96bfd96c,你做不到理性，仅凭你个人某个片来断定，你就不合格，你就不配做父母。,3296.493,1611056281,16777215,1
e083326d,为什么不找自己的问题呀,2960.393,1611056300,16777215,1
e4ff5a98,人年纪大了，有点顽固犟脾气，能理解,3214.119,1611056345,16777215,1
533cce83,这是他八十多的爸啊，不笑还能怎么办？你摊上个试？,2141.0,1611056351,16777215,1
267fa339,别说他爸了，这男的就不值得荷叶复婚,3000.326,1611056356,16777215,1
25f160a0,天啊他爸怎么沟通啊,2384.909,1611056365,16777215,1
c6e4bbfb,还有指责荷叶的？你公相见礼上就骂你爹妈，你会对你公好,2218.314,1611056366,16777215,1
25f160a0,累人,2390.417,1611056371,16777215,1
2027df40,既然已经离了，即使对孩子很残忍，也不希望荷叶姐复婚！,3083.061,1611056382,16777215,1
35103773,你知道你还说？,2481.619,1611056395,16777215,1
935cf67,因为被骂了,3151.975,1611056397,16777215,1
267fa339,他爸买不买房，最后都会离，这男的就不行,3024.588,1611056405,16777215,1
9d0204a5,这个姐真的是什么都敢说,788.033,1611056416,16777215,1
eaf8dc7b,韩国的礼仪文化很重,2247.835,1611056422,16777215,1
9d0204a5,太坦诚了,801.66,1611056431,16777215,1
35103773,然后你儿子把嫁妆卖了,2519.819,1611056433,16777215,1
b5b3533c,弹幕里这些女的是被多少渣男玩弄过？对真爱没自信了,3559.758,1611056464,16777215,1
2d8865c4,这爸第一集可不是这么说的,3004.03,1611056471,16777215,1
94487e55,？主持人神回路,4339.049,1611056486,16777215,1
c6e4bbfb,哈，自己儿子都没做好,2286.764,1611056487,16777215,1
16eb6b60,接受了自己能力范围之外的事情，结婚生活压力太大，矛盾也越来越多,2869.514,1611056492,16777215,1
8975c7c5,卧槽？什么展开？,3001.648,1611056497,16777215,1
320a53ff,韩国对这种礼仪很在乎的只看这段叙述是事实的话荷叶做的确实欠妥,2234.516,1611056525,16777215,1
3a563400,但是买的房子也是男方名下，离婚女方是净身出户啊！,2605.0,1611056525,16777215,1
267fa339,最后发现就是烤肉的问题,3240.845,1611056549,16777215,1
56b1366a,那你在孙女面前骂她妈是咋想的,2984.391,1611056554,16777215,1
56b1366a,哇，太好了！,3002.131,1611056579,16777215,1
1ae70299,窒息的一对,1713.808,1611056584,16777215,1
958c6ddc,离婚了再这样真的很尴尬,983.307,1611056585,16777215,1
96e8d2bf,女方的意思是现在没爱了复婚肯定没有男方努力付出多，会让男方又有伤害的意思,4350.661,1611056587,16777215,1
3a563400,两亿买的房，是婚前财产，人家离婚一分没拿，女方的一千万嫁妆可被你儿子都卖了！,2615.808,1611056600,16777215,1
e4ff5a98,不要为了孩子结婚就让父母背债,3386.459,1611056602,16777215,1
72050a0b,可以准备一些仪式感吗求婚之类的这些话好像是回复网友评论的一样,3790.309,1611056615,16777215,5
9d0204a5,哈笑死了,982.877,1611056616,16777215,1
64f98e3e,凡是主动离婚的女人都是有自己的想法的所以这个节目很有深度,5534.462,1611056631,16777215,1
72050a0b,你先提出离婚哈这段话真的不是精心准备过背诵过的吗,3808.47,1611056668,16777215,5
b03f8066,老人好心要让孩子住好点孩子却因为房子看老人眼色活着,2928.934,1611056728,16777215,1
1672ac4d,他是来气前妻的吗哈,232.325,1611056728,16777215,1
96e8d2bf,这妈有点腹黑的赶脚,4496.522,1611056735,16777215,1
54ecd657,这也太奇葩了吧朋友随意进家里,1212.648,1611056747,16777215,1
56b1366a,啊老头能这样说还是挺不错的，果然韩国网民都把你们骂醒了,3106.491,1611056763,16777215,1
d37e9ab4,怎么来了给你行个大礼跪两下人家不养孩子不干嘛了,2187.183,1611056764,16777215,1
96e8d2bf,这节目好烦一集剪出一座大山,4539.418,1611056778,16777215,1
b2fcc363,要说啊，你不是韩国人可能不太理解，看过RM吧，智孝都经常说，睡前，欧巴晚安，睡醒了，欧巴睡得好吗？就是等于谢，你好之类的，像日本的，我回来了，欢迎回来一样,2224.663,1611056792,16777215,1
64783454,韩国把礼仪看得很重的,3226.614,1611056794,16777215,1
72050a0b,一个人房子又是男方的未婚先孕生孩子后做了一段全职妈老公又不理你公又骂你抑郁了只能写日记,3875.471,1611056820,16777215,5
aa7f552,反正他的意思就是自己以外都有错呗,2808.702,1611056830,16777215,1
dadcd756,所以说要遇到好人，无论在不在一起都好,1697.52,1611056848,16777215,1
1ae70299,搞成恐怖片的气氛了,1970.968,1611056863,16777215,1
9fde92a7,不是说当初相见礼的时候说了不好听的话？,2578.939,1611056864,16777215,1
e8e3b1a3,对啊这男的我真是不懂这是来开山了还是来转移火力了,2883.369,1611056865,16777215,1
9575d2ae,可怕,1977.497,1611055019,16777215,1
451fd614,同上,3604.85,1611055040,16777215,1
33e08f0,过去的就是过去了，都把姐伤透了再转头说变了，心早就凉了,4404.207,1611055043,16777215,1
96bfd96c,你牛逼的话，你家里市区一套房，一辆甚至两辆车，都是你自己，或者你们俩自己挣得，你当然硬气。,2738.655,1611055045,16777215,1
e4ff5a98,长的好看还能挣钱，你还要啥自行车啊,2363.019,1611055049,16777215,1
51c1e013,参加这个节目也挺好的，通过镜头以第三方视角审视了自己,3110.739,1611055060,16777215,1
a650cae3,你在说什么？,2802.641,1611055060,16777215,1
de9b8b96,讲来讲去离婚都是别人的问题,2916.735,1611055064,16777215,1
ff52a28a,还是沟通问题,2510.556,1611055070,16777215,1
e9c5b660,这姐真的很帅气啊,1478.936,1611055078,16777215,1
64f98e3e,没戏当女人不流泪了就是真的累了,4039.085,1611055084,16777215,1
d21e2be4,我也反对,3515.348,1611055090,16777215,1
e9c5b660,两个人都很好，但就是不合适罢了,1494.394,1611055110,16777215,1
e8e3b1a3,不敢看了草,1975.849,1611055134,16777215,1
e471b9ba,哈在哪都躲不过zs了,1475.681,1611055134,16777215,1
9227df22,这。,2221.039,1611055143,16777215,1
af357ce7,离婚原因一直不说诶,2555.035,1611055148,16777215,1
b16e5c29,你和儿子结婚吧无语了,2067.723,1611055150,16777215,1
5504a05,就算是问候，你还会从其他方面挑毛病,2249.854,1611055152,16777215,1
51c1e013,爸是不是被骂怕了哈,3178.759,1611055154,16777215,1
267fa339,说话嘴巴不能张开么。,2084.026,1611055156,16777215,1
16c2df3b,当初伤害的时候咋就没想过呢，世上没有后悔药,4622.165,1611055162,16777215,1
e9c5b660,男生偏感性，女生理性更多。他们其实都挺好，只是不合适而已,1520.268,1611055162,16777215,1
db9ff5d9,深情男,1380.693,1611055167,16777215,1
96bfd96c,外来的钱不安心，本来就是，你凭空得到的，你自己安心吗？,2780.372,1611055172,16777215,1
1a528052,人家是已经不爱了好不好,4342.846,1611055174,16777215,1
d21e2be4,因为已经受过伤如果下一次又再同一个问题上受伤那更难缓过来,3547.177,1611055174,16777215,1
2d225abf,醉了这发言,2792.751,1611055186,16777215,1
e9c5b660,男生是以身作则的人啊，很赞,1541.726,1611055188,16777215,1
e4ff5a98,买不起大房子就买小的，女方家不想出干嘛挑刺,2477.379,1611055193,16777215,1
9227df22,其实从一开始就不喜欢,2273.69,1611055196,16777215,1
e8e3b1a3,我都搞不清是在演戏还是真实了,2032.009,1611055206,16777215,1
e9c5b660,两个人都真的很好，只是不合适而已,1550.969,1611055206,16777215,1
72050a0b,故意黑吧洗白韩网扒他太多要改舆论？,2704.599,1611055212,16777215,1
8c4a26b7,来洗白了不会吧,2647.401,1611055217,16777215,1
b5b3533c,礼节在韩国很重要啊,2248.798,1611055220,16777215,1
267fa339,知道你看到了我就放心了,2108.531,1611055226,16777215,1
28cf7f1a,每个人都很好放一起不一定好,1571.802,1611055243,16777215,1
64f98e3e,刚才这男的说那么多的时候女的没有流眼泪就说明了一切,4211.535,1611055256,16777215,1
f510a690,这家完全男女颠倒啊,213.899,1611055257,16777215,1
9cef7445,确实误会人家爸了对不起烤肉爸,3227.366,1611055258,16777215,1
42ba33c6,这也太精致了,381.624,1611055263,16777215,1
96bfd96c,伤父亲心就另说了，女权在弹幕是真的牛逼，你什么都不用管，什么都是别人准备好给你放到面前。,2801.966,1611055264,16777215,1
e4ff5a98,没法复婚，就算公没了，还有大姑子呢,2533.239,1611055271,16777215,1
e9c5b660,两个人都在认真履行自己的责任，只是不合适而已,1627.272,1611055285,16777215,1
33e08f0,真想挽回，就用实际行动吧，天好守护她,4660.395,1611055299,16777215,1
54ecd657,还是短发没有胡子好看，现在很油腻,451.391,1611055300,16777215,1
e8e3b1a3,呀你居然知道哈真不好意思会继续的哈,2101.369,1611055306,16777215,1
bed8a5fa,对儿子不是强势的人只是对儿媳妇是强势的人,3168.499,1611055318,16777215,1
42ba33c6,姐太果断了,484.443,1611055324,16777215,1
64f98e3e,不爱就是不爱了也别说太多了,4287.483,1611055332,16777215,1
e9c5b660,这对夫妇能看出来人真的很好,1689.589,1611055343,16777215,1
9227df22,又来了,2420.884,1611055343,16777215,1
42ba33c6,因为不想复合啊,546.619,1611055360,16777215,1
267fa339,这男的活了七八十年，心眼咋这么小,2228.823,1611055363,16777215,1
d21e2be4,我也觉得只是改变一段时间久了还是会回归本性,3892.72,1611055363,16777215,1
96bfd96c,中国的女权继续牛逼下去，古人云，不食嗟来之食，你们随便写宣传就可以洗脑很多人，厉害。,2810.759,1611055390,16777215,1
8b91996,这样也挺好,4714.97,1611055401,16777215,1
38e535ca,主持人是觉得荷叶有顾虑，没有完全吐露真心,4363.197,1611055407,16777215,1
c6e4bbfb,韩国网友果然不出所料哈,2083.803,1611055412,16777215,1
d21e2be4,他爸吼过女方？,3949.177,1611055414,16777215,1
d81a96cf,omg！,978.295,1611055416,16777215,1
c6e4bbfb,韩国网友厉害,2090.718,1611055424,16777215,1
64f98e3e,我咋觉得是轻快了,4362.494,1611055439,16777215,1
267fa339,还不是你结婚当天和丈母娘闹，荷叶才不和你说话的，你自己心里没点儿数么？,2269.752,1611055441,16777215,1
fcadbe21,他这样说让他爸寒透了心啊，这不是解决方法啊,2796.375,1611055446,16777215,1
d21e2be4,这算不算拿孩子威胁女方,3997.476,1611055465,16777215,1
96bfd96c,你们这些女权话都没听完就可以出来非议，当然，弹幕不违法，随便你们怎么说。你厉害，你结婚不结？你不结婚当我没说，你结婚了你儿子或者你女儿过了20多年也得面对这么个情况。,2826.421,1611055491,16777215,1
1c409b8,每次笑都好欠扁的样子,2948.202,1611055495,16777215,1
bed8a5fa,这矛盾难道不是从相见礼说了难听的话开始的吗,3285.839,1611055506,16777215,1
c6e4bbfb,这烤肉还在笑？虽然他爸有问题，但他也并不孝顺啊！,2129.072,1611055511,16777215,1
64f98e3e,这个撇嘴一笑,4440.614,1611055518,16777215,1
c6e4bbfb,虽然他爸有问题，但他也并不孝顺啊！这烤肉还在笑？,2115.937,1611055523,16777215,1
d21e2be4,离婚前经历了事后的道歉没有用了,4053.924,1611055534,16777215,1
9575d2ae,其实也有道理,2494.581,1611055536,16777215,1
5ba41872,what,2875.102,1611055541,16777215,1
2027df40,我去，我连他的台词都猜到了。,2333.864,1611055556,16777215,1
ff52a28a,爸真的是好爸啊,3010.712,1611055557,16777215,1
267fa339,漂亮！,2378.469,1611055563,16777215,1
b5b3533c,批评男主的人都是女犬啊，观点特别极端,2596.129,1611055568,16777215,1
42ba33c6,离婚了还是不用吧,980.62,1611055568,16777215,1
5ba41872,whatdoyouwantfrome,2875.102,1611055574,16777215,1
f4654bf,这两年轻也不对，过节都会回去探望，徒增误会,2844.202,1611055580,16777215,1
d21e2be4,姐争气好样的,4126.143,1611055592,16777215,1
2d8865c4,所以被骂也没错啊,2158.291,1611055602,16777215,1
fcadbe21,看到现在明白了，问题不在他爸，原因就是男的自己,2920.358,1611055604,16777215,1
b16e5c29,救命哈这两个像约好了一起在这儿说相声,2374.953,1611055618,16777215,1
d21e2be4,欧尼太棒了,4141.502,1611055619,16777215,1
f510a690,这样打招呼有啥问题，带着孩子独自在家，还要咋样？,2186.895,1611055625,16777215,1
c6e4bbfb,爸被网友骂，儿子在笑？他爸是有问题，更有问题的是他吧？,2114.778,1611055627,16777215,1
23cb4756,他自己说了荷叶才生完孩子，哪来那么生龙活虎啊？,2272.755,1611055647,16777215,1
39d0053f,那这样老爸怎么想？出了钱你还来怪我做的不对？,2784.286,1611055651,16777215,1
33c0d266,装不下去贤妻良母了哈,781.893,1611055654,16777215,1
82e1be12,都很好，只是不适合彼此,1697.586,1611055663,16777215,1
e9c5b660,现在是在倚老卖老吗？自己做的什么事自己还不清楚吗？！,2137.917,1611055672,16777215,1
f510a690,独自带着孩子哪有精力随时打扫卫生？你收拾下咋啦？,2209.855,1611055680,16777215,1
e4ff5a98,那丈母娘的咋不给？,2735.499,1611055681,16777215,1
39d0053f,天啊突然觉得这父亲也很可怜了,2813.726,1611055689,16777215,1
c6e4bbfb,烤肉好自私啊，还让老父亲背锅,2115.912,1611055690,16777215,1
de9b8b96,他们家老是对着孩子谈这些问题真的不太好吧,3511.315,1611055693,16777215,1
f510a690,还得给你请安？,2227.055,1611055713,16777215,1
fcadbe21,别复婚啊，不是他爸的问题，这男的不行,3005.795,1611055714,16777215,1
d21e2be4,越坚决越说明过去伤的太重不敢再受,4192.446,1611055716,16777215,1
451fd614,这得是伤多深？,4275.73,1611055757,16777215,1
96bfd96c,你现在不怪老头了？哈，,3025.433,1611055763,16777215,1
28cf7f1a,那可不,2103.165,1611055774,16777215,1
db9ff5d9,不过这老爷子为什么同意拍摄呢,1974.186,1611055782,16777215,1
9717d6d4,还有这种儿子。辣鸡呀,2792.212,1611055795,16777215,1
42ba33c6,离婚真的离得很和平,1500.912,1611055800,16777215,1
b60fd8d0,其实还是丈夫没有协调好就别复婚了吧,3281.066,1611055804,16777215,1
8fd31d83,想要弹幕护体了怎么办,1980.395,1611055807,16777215,1
d21e2be4,姐通透她才是最知道这个男的是什么样的人,4280.255,1611055812,16777215,1
935cf67,棋逢对手哈,2309.681,1611055823,16777215,1
f510a690,你先看你作长辈的做到位没？再说小辈的行不行！,2313.255,1611055832,16777215,1
db9ff5d9,这老爷子喜欢孙女的样子,2017.706,1611055838,16777215,1
451fd614,小姐是怕江山易改禀性难移？,4339.45,1611055843,16777215,1
9575d2ae,这爸也太惨了,2803.494,1611055845,16777215,1
4843411c,这样一看松莉匹和爷长的好像啊,3058.573,1611055849,16707842,1
39d0053f,他为什么死活不明说离婚原因？其他几对都开诚布公的说了,2965.961,1611055849,16777215,1
96bfd96c,女权怎么突然哑了？,3073.12,1611055849,16777215,1
dadcd756,真的很gay啊,371.841,1611055850,16777215,1
e4ff5a98,这不是开山，这是又筑了道墙。,2882.119,1611055870,16777215,1
56b1366a,紫苏也说离婚是因为两人没有爱了，所以应该也不全是老头的问题,2560.935,1611055884,16777215,1
d21e2be4,不是只有他爸的问题还有他姐,4358.519,1611055886,16777215,1
519184f7,这些b，懂个屁,4295.571,1611055890,16777215,1
96bfd96c,女权怎么不说话了？,3118.385,1611055894,16777215,1
c6e4bbfb,谁让你之前骂亲家的？,2179.647,1611055897,16777215,1
6c247f6e,男的真的好糟糕啊好生气啊,3031.154,1611055903,16777215,1
fca43b73,什么男跟女的讲不通你看过一只鸡吗,2592.243,1611055910,16777215,1
ee47db05,这也规矩太重了吧,2224.411,1611054115,16777215,1
451fd614,他俩不在一个点上,2855.148,1611054156,16777215,1
3308fc8b,会被骂得更惨吧哈,2103.106,1611054175,16777215,1
6363acbe,哈，两级反转,1097.633,1611054193,16777215,1
451fd614,赞同前面,2895.308,1611054206,16777215,1
849d2385,听到这句话内心还是会有酸楚的感觉吧,1608.401,1611054209,16777215,1
fca43b73,哈送内衣绝了，还是离婚夫妇,1161.943,1611054233,16777215,1
3522fc95,这男的真的不是故意的吗,883.688,1611054237,16777215,1
abd2eac4,因为是对的,2142.522,1611054255,16777215,1
58a385cd,nice！,4124.073,1611054269,16777215,1
5abfd1ad,火上浇油？,2706.297,1611054278,16777215,1
abd2eac4,你不挨骂谁挨骂,2169.568,1611054283,16777215,1
451fd614,我觉得是他爸垫了这么多钱，女方没拿，心里不平衡，才会有后期那么多事儿,2962.828,1611054310,16777215,1
3308fc8b,这能怪女生？你自己不说出来默记下,2211.315,1611054312,16777215,1
58a385cd,很清醒,4159.486,1611054313,16777215,1
51c1e013,这样看着他爸也挺讲理的啊,2565.139,1611054336,16777215,1
58a385cd,已经回不去了不爱了,4183.209,1611054352,16777215,1
451fd614,同意复婚？,2999.148,1611054354,16777215,1
64f98e3e,这是要挟吧,3017.013,1611054373,16777215,1
ee47db05,现在这么说,2494.072,1611054393,16777215,1
53fc30eb,什么意思？没明白,2799.871,1611054393,16777215,1
d21e2be4,这男的推卸责任一把好手一开始把责任推给女方现在把责任推给他爸心机男,2704.404,1611054428,16777215,1
451fd614,这时候得点赞了,3058.068,1611054429,16777215,1
b60fd8d0,韩国本身就是很重礼仪加上他爸年纪好大应该是很看重礼仪了,2311.636,1611054475,16777215,1
e8e3b1a3,听到了吗法外狂徒zs,1470.289,1611054488,16777215,1
84481504,哈我也鼓掌了,1031.566,1611054488,16777215,1
51c1e013,这样又爸关系恶化了啊,2704.439,1611054495,16777215,1
9cef7445,这样说觉得老父亲也太可怜了,2807.961,1611054561,16777215,1
e0e6e69e,你们懂别人的文化吗？,2238.29,1611054571,16777215,1
d21e2be4,？要女的跟着你受苦还觉得不该你爸管你推卸责任的话术一套的,2784.446,1611054577,16777215,1
451fd614,韩国的问候跟中国不一样吧！,3220.779,1611054609,16777215,1
96bfd96c,一群女权在作而已。,2568.307,1611054618,16777215,1
53fc30eb,？这爸好像没那么坏啊,3008.682,1611054648,16777215,1
96bfd96c,男的跟女的讲道理讲得通吗？你自己品,2574.109,1611054653,16777215,1
7629920d,崔烤肉就是个人渣,2524.052,1611054668,16777215,1
c6e4bbfb,蔚山！建厚娜恩jinu的城市！,1959.121,1611054669,16777215,1
c6e4bbfb,建厚娜恩jinu的城市！蔚山！,1966.91,1611054677,16777215,1
e8e3b1a3,真是好父母,1634.169,1611054686,16777215,1
f4654bf,就是大爷把出了婚房的这个理由，变成过度干涉了这对夫妻的生活的条件,2796.841,1611054686,16777215,1
c6e4bbfb,因为建厚娜恩和jinu，特别喜欢蔚山！,1976.974,1611054687,16777215,1
51c1e013,意思是说当初应该结婚不买房，两方父母什么也不出，他们两个自己打拼赚钱？,2800.319,1611054690,16777215,1
fcadbe21,旁观者清啊,2124.642,1611054692,16777215,1
72050a0b,第一次父母见面你这么凶对她妈当然怕你啦,2254.732,1611054731,16777215,1
89c9a8df,谁能接受的了,244.51,1611054749,16777215,1
96bfd96c,窒息了不会打120么，你说的那么惊险你现在死了没有？,2612.231,1611054755,16777215,1
89c9a8df,哈几码,254.02,1611054759,16777215,1
f3847ca,想起来刘嘉玲说自己不要孩子是因为责任太重,1588.918,1611054770,16777215,1
d21e2be4,不至于主要是男的问题不要复婚,3018.601,1611054775,16777215,1
110b2a6d,我有些无语这男的？话能说成这样？,2816.105,1611054795,16777215,1
51c1e013,爸该多寒心啊,2887.159,1611054796,16777215,1
451fd614,成功洗白,3353.913,1611054814,16777215,1
96bfd96c,各位女权自己想自己的爸，亲爸，你们没有爸吗？,2651.099,1611054839,16777215,1
d21e2be4,这肯定是私下就跟他爸沟通了的但是还是不建议复婚,3071.337,1611054850,16777215,1
a20edd61,父母老了给赡养费不对吗？,2693.203,1611054856,16777215,1
9cef7445,狗崽子真的是到处给别人找原因,2930.495,1611054861,16777215,1
8b91996,女方总是比男方成熟很多,4227.93,1611054910,16777215,1
110b2a6d,我现在确定了这段婚姻百分之一万是这男的问题而不是爸,3020.073,1611054910,16777215,1
fca43b73,开始生气,1710.123,1611054911,16777215,1
ee47db05,隔代亲,3007.455,1611054914,16777215,1
de9b8b96,给房子还给出错了。,2786.955,1611054919,16777215,1
96bfd96c,女权之上者，你不能给你爸妈，只能给我爸妈。,2695.446,1611054929,16777215,1
ff52a28a,爸很委屈哈,2403.339,1611054940,16777215,1
fca43b73,哇在妈家待了一周，好幸福,1728.343,1611054947,16777215,1
9cef7445,千万别复婚这男的真的不行,3000.91,1611054947,16777215,1
3308fc8b,人间迷惑,2800.684,1611054949,16777215,1
9227df22,说了就不让去了吧。,2059.469,1611054952,16777215,1
56b1366a,哈紫苏好可爱,1808.082,1611054956,16777215,1
a4ceb892,人的感情是很复杂的，只要不是选择性错误，希望能有好的结果吧,4017.106,1611054971,16777215,1
e4ff5a98,爸八十多，烤肉再婚找个六十岁阿姨，应该更懂礼仪,2321.839,1611054989,16777215,1
7629920d,你小子，自己活吧,2779.967,1611054994,16777215,1
2296e702,卡戴珊他爸和她妈,363.578,1611053220,16777215,1
625ddc87,拿孩子绑架？,3998.046,1611053226,16777215,1
780029aa,服了,2228.009,1611053327,16777215,1
6edb688a,ac讨厌这样,978.024,1611053334,16777215,1
625ddc87,姐独自美丽,4183.475,1611053335,16777215,1
16de8dd1,看起来男方家也没多有钱啊,2081.023,1611053341,16777215,1
ed331f41,无论荷叶做什么决定都支持她这是她自己的生活一定按自己的想法过,3599.511,1611053341,16777215,1
f327eca6,很自我啊把所有的错怪在别人身上,3191.766,1611053366,16777215,1
