Sender,DmContent,AppearTime,SendTime,FontColor,DmType
7e5ddeb4,哈太喜欢这家了,781.398,1611052152,16777215,1
4cc7db07,夫妻两个情商都不高误解大了,2996.098,1611052207,16777215,1
138f6ae2,所以说结婚后还是尽量自己夫妻住,2366.454,1611050502,16777215,1
4ae44672,东方人把离婚看的太严重了，其实离婚是为了更好的生活,6176.242,1611050525,16777215,1
c14de909,她可不是一半的漂亮啊，无死角的那种,2315.788,1611050553,16777215,1
b241b24,这俩以前还一起拍过mv？,7018.112,1611050712,16777215,1
6a287d10,别人家事观众确实不要批判那么多特别是人身攻击的,2084.179,1611051079,16777215,1
dd85baf1,阿姨没了吗？,1776.759,1611051084,16777215,1
6a287d10,我也觉得烤肉找了老父亲背锅,2096.98,1611051108,16777215,1
b509de2,前提说改变要说到做到,4071.507,1611051138,16777215,1
6a287d10,父亲没有跟夫妻一起住的只是偶尔去一下,2378.196,1611051245,16777215,1
892a537c,真的是个好人只是真的不适合,1550.012,1611051310,16777215,1
c6e4bbfb,哈，这些衣服都是这个姐买的，只是这大叔自己搭的,394.499,1611049660,16777215,1
d847357,比起善不善良，你是先入为主和固执,3398.596,1611049667,16777215,1
d36adc9b,怎么好像空耳听到中文,1726.662,1611049672,16777215,1
7bc64dae,漂亮！,4094.921,1611049677,16777215,1
d36adc9b,是蜡笔小新吗,1726.662,1611049690,16777215,1
cfbdfb9f,反正还要拍那么几期，双方不是也要挣钱吗，最后才知道,4094.62,1611049693,16777215,1
c6e4bbfb,这大叔还真是长发好看,430.064,1611049697,16777215,1
c6e4bbfb,这对夫妻好玩，真的欢喜冤家,442.763,1611049717,16777215,1
6ddb70c5,前面的，就是他们夫妻之间的问题！非要扯东扯西，怪罪这个怪罪那个，孩子和公岳母都可怜。,2992.205,1611049740,16777215,1
c7c6f171,我也觉得，不爱了只剩下责任，这样复婚更累,4325.276,1611049769,16777215,1
cfbdfb9f,看来荷叶也是看了评论啊，清醒了，不知道后面做不做得到！,4117.988,1611049770,16777215,1
d847357,再过段时间再看吧,3505.522,1611049776,16777215,1
c6e4bbfb,这俩真的像个弹幕哈,525.871,1611049815,16777215,1
c6e4bbfb,好喜欢看这种，他们看别人生活，然后评论自己的,548.265,1611049855,16777215,1
f430a72d,看见大叔委屈巴有的想笑哈,1489.619,1611049982,16777215,1
cfbdfb9f,烤肉，别厚颜无耻了，麻烦你,4200.866,1611049983,16777215,1
f430a72d,哇，帅气,1525.211,1611050018,16777215,1
cfbdfb9f,可不是，没有爱，搭伙过日子吗？两个人也是折磨啊！孩子可以自己带，什么年代了,4222.908,1611050032,16777215,1
cfbdfb9f,在一起的时候不珍惜，以为有后悔药吗,4249.978,1611050065,16777215,1
cfbdfb9f,男方在演戏。,4268.434,1611050083,16777215,1
138f6ae2,论血缘也是荷叶关系比你亲呀,1997.871,1611050127,16777215,1
b241b24,这。真的挺对不起的原本以为是爸导致的离婚其实烤肉才是那个最有问题的人,2076.831,1611050141,16707842,1
b241b24,烤肉自己也有问题,2094.111,1611050176,16777215,1
cfbdfb9f,荷叶妈才是真正为了女儿好,4455.323,1611050233,16777215,1
cfbdfb9f,荷叶估计看了评论，才知道妈多辛苦！,4456.645,1611050246,16777215,1
cfbdfb9f,我也是这样的,4484.775,1611050275,16777215,1
c14de909,这就是为啥别人骂你,2134.841,1611050301,16777215,1
b241b24,还不是被你吓的,2199.111,1611050310,16777215,1
cfbdfb9f,这男的又要开始放大招了吗,4531.256,1611050321,16777215,1
cfbdfb9f,你倒是把钱还给前岳母啊，说那么多废话,4569.216,1611050372,16777215,1
cfbdfb9f,主持人让人讨厌,4591.645,1611050412,16777215,1
cfbdfb9f,主持人是为了节目配合的,4601.255,1611050422,16777215,1
aeb42895,我服了，这些话你现在告诉你爸干啥,2682.892,1611048772,16777215,1
cfbdfb9f,有爱吗？复婚？在清朝吗？,3412.066,1611048799,16777215,1
1098df81,感觉偷看了我们的评论一样,3774.339,1611048810,16777215,1
cfbdfb9f,赞成！,3485.079,1611048878,16777215,1
cfbdfb9f,闺蜜，人间清醒！,3494.431,1611048887,16777215,1
c7c6f171,别这么绝啊，我爸离婚之后还是没说过要努力的话，知道反省已经很难了,3488.847,1611048889,16777215,1
aeb42895,跟荷叶一起的时候是荷叶有问题，跟爸就是爸有问题，他咋这么渣，觉得老人好可怜，要难过了,2806.299,1611048895,16777215,1
77a419fd,帅气的不是这位baby吧估计,1214.859,1611048909,16777215,1
aeb42895,明是这男的在婚姻没有做好，现在怪前妻，怪爸怪亲戚，唯独没怪自己,2855.953,1611048945,16777215,1
60bd1061,主持人为什么都,4584.661,1611048980,16777215,1
612ce601,最喜欢的是烤肉荷叶,4940.628,1611049031,16777215,1
677d2619,五年都没有出去玩过，我可怜的荷叶,4538.324,1611049086,16777215,1
677d2619,好虚伪,4664.958,1611049200,16777215,1
aeb42895,这俩年轻人就过了个家，不会解决问题，没有礼仪，最后分开了，把所有的事都推给了别人,3049.28,1611049207,16777215,1
d847357,爸年纪大是老一辈的思考逻辑和体系,3017.898,1611049236,16777215,1
aeb42895,就这俩的为人处事，根本过不长久。老头子就算不出现，也会因为别的问题分开,3005.316,1611049255,16777215,1
677d2619,能别打造痴情人设了吗？你爱她根本就不会那样对她，也不会离婚,4687.913,1611049268,16777215,1
c2659ff8,不为孙女想为自己想吗？单亲家庭的孩子有多难老爷子比谁都清楚,3113.022,1611049275,16777215,1
77a419fd,对不起我笑了,1499.587,1611049290,16777215,1
cfbdfb9f,有留恋，还有心思交女友,3747.898,1611049295,16777215,1
c2659ff8,这样看不是爸的问题，还是烤肉不成熟,3130.387,1611049319,16777215,1
cfbdfb9f,别信他！,3783.977,1611049331,16777215,1
cfbdfb9f,又不是清朝！自己把孩子争取过来，一个人养不活吗？,3801.937,1611049349,16777215,1
c2659ff8,爸只要不带敌视情绪，自己有在反省，是烤肉还不知道问题在自己身上,3191.096,1611049403,16777215,1
c6e4bbfb,喜欢BGM,153.843,1611049409,16777215,1
edb734d0,我是荷叶的妈，估计也不让女儿再婚吧,4476.606,1611049444,16777215,1
c6e4bbfb,但这个大叔居然有腹肌,227.315,1611049465,16777215,1
75298798,不说对错，男方太沉迷于自我感动了,4256.163,1611049465,16777215,1
77a419fd,阿西八,1679.003,1611049480,16777215,1
aeb42895,这男的真是负情商,3145.572,1611049496,16777215,1
849f8c3f,开心！等到周更！,220.076,1611049498,16777215,1
c7c6f171,我也觉得，要是还有一点爱的话也不会不相信对方了,4106.231,1611049526,16777215,1
c2659ff8,反思了啊说了自己也是说话不好听,3257.178,1611049558,16777215,1
c2659ff8,不是爸，还是烤肉的问题,3312.41,1611049604,16777215,1
aeb42895,这么个负情商的人，本来俩人没事也给整出事了，更何况本来就有点不满意,3272.227,1611049623,16777215,1
cfbdfb9f,拿人手短？这是父亲为了他的幸福给他的，现在他这样说，岂不是让父亲背锅？父亲还错给钱给他了？,2761.268,1611047865,16777215,1
120c1ccd,韩国没有退休金这样的东西，所以老人真的首尔出租很多都是老人家的原因,2720.916,1611047871,16777215,1
cfbdfb9f,父亲被他摆了一道。,2779.439,1611047905,16777215,1
4cc7db07,这个bgm也是绝了,1925.886,1611047913,16777215,1
aeb42895,这么小能知道个啥？,1882.081,1611047960,16777215,1
cfbdfb9f,烤肉真的心眼坏，上一期利用松叶，让荷叶背锅，这次该自己老父亲了,2868.721,1611048029,16777215,1
c2659ff8,那两个年轻人因为你也活着平白受折磨了啊,2113.528,1611048057,16777215,1
e8413ed5,？有毒啊,2695.726,1611048095,16777215,1
b509de2,不是希望你不出现，是希望好相处,2981.267,1611048142,16777215,1
cfbdfb9f,烤肉无非是把离婚责任推卸给父亲，你们还没看懂？,2929.432,1611048161,16777215,1
677d2619,不要，荷叶你值得更好的,3788.201,1611048178,16777215,1
1098df81,说到底还是为了他孙女，万一有事估计又会对荷叶发难,3089.636,1611048190,16777215,1
d847357,她是通过对你怎样去获得分数的吗？,2158.54,1611048221,16777215,1
677d2619,看到没，不是说荷叶暴脾气吗？明就是烤肉一直在骂荷叶,3812.521,1611048235,16777215,1
4364fc6e,血压升高预警,1685.435,1611048286,16777215,1
a5f7654a,不能全怪烤肉爸自己住在这个地方，给他们两亿买房子，还要怎么样呢？这两亿不是大风刮来的啊,3270.098,1611048293,16777215,1
c30da971,是你主要造成的啊,2090.817,1611048317,16777215,1
d847357,女生是很凉薄的人，特别对她妈,2238.478,1611048319,16777215,1
cfbdfb9f,真是烤肉根荷叶的问题父母责任并不是最大的,2992.87,1611048321,16777215,1
c30da971,现在知道是人家两个结婚不是你结婚了，早知道的话对媳妇那样？,2093.83,1611048349,16777215,1
77a419fd,我觉得以前更好看,786.816,1611048481,16777215,1
cfbdfb9f,烤肉不简单啊，坏,3130.14,1611048487,16777215,1
77a419fd,那张高糊的以前的照片像李允智姐,807.336,1611048501,16777215,1
c7c6f171,真的是缺乏沟通啊,3218.843,1611048502,16777215,1
677d2619,道歉有用的话要警察干嘛,4082.004,1611048525,16777215,1
cfbdfb9f,长得一副贼眉鼠眼，还那么渣,3173.071,1611048531,16777215,1
1e61da4c,你个老头才是负分吧,2138.678,1611048544,16777215,1
c2659ff8,这话太伤人了,2778.088,1611048552,16777215,1
c2659ff8,烤肉还是不成熟,2802.783,1611048576,16777215,1
cfbdfb9f,你看吧，这句话，又在挑事了，无形间把荷叶跟老爸关系拉远,3225.306,1611048611,16777215,1
1e61da4c,什么时代的礼数啊,2204.485,1611048627,16777215,1
c7c6f171,离婚肯定不可能只是某一方的原因，如果还有余地，就好沟通吧,3306.648,1611048643,16777215,1
cfbdfb9f,别人再说，这是八十多岁的前公，给前儿媳妇道歉？荷叶心里过意的去？,3280.03,1611048667,16777215,1
c2659ff8,伯父真的被误解的很深啊,2966.259,1611048695,16777215,1
60bd1061,难道重点不是没有爱了吗,4318.954,1611048702,16777215,1
c7c6f171,但那也不是强求的啊，人家女方没能力拿那么多，为什么要强求呢,3341.807,1611048710,16777215,1
cfbdfb9f,没有爱的婚姻，为了孩子复合，也是一种折磨,3343.873,1611048731,16777215,1
c2659ff8,可是复婚是父亲从此孤家寡人孩子压力更大，算了，不合适,2984.561,1611048732,16777215,1
677d2619,我也不相信会改变，演给观众看而已，荷叶太了解烤肉了,4221.737,1611048738,16777215,1
c7c6f171,突然觉得老头儿有点可怜了,2768.111,1611047029,16777215,1
a286ab92,烤肉起码对岳母还是会问好的,2299.627,1611047039,16777215,1
677d2619,果然，我就知道，老头子怎么可能感觉愧对荷叶呢，果然是为了松叶,2953.278,1611047073,16777215,1
c7c6f171,老头儿也没那个意思吧，没说给你们钱你们就得听我的呀,2812.239,1611047092,16777215,1
c7c6f171,老头儿对儿媳妇的不满应该是因为观念，不是因为钱,2812.579,1611047114,16777215,1
180476e0,粉色泡,7035.247,1611047122,16777215,1
cfbdfb9f,简单来说，荷叶不会处事，不能说全部是老头的错，老年人很注重这些！,2218.474,1611047125,16777215,1
ead2ab10,？这还拍上了MV？,7031.016,1611047161,16777215,1
c6ee9628,你这发言把你爸都阵住了，也是人才,3122.907,1611047169,16777215,1
677d2619,你直接说以后别给我转钱了，这五年转的钱都还给你不就好了,3026.751,1611047172,16777215,1
c7c6f171,开始可怜老头儿了,2878.788,1611047188,16777215,1
677d2619,这老头一辈子大男子主义，根本改不了，就是镜头前说而已,3055.166,1611047229,16777215,1
c7c6f171,把问题说的太复杂了，就说这是我自己的生活我自己看着办,2903.622,1611047241,16777215,1
a5f7654a,弹幕是听不懂吗？烤肉是在说因为拿了两亿接受了帮助，所以他拿人手短，他不应该接受帮助才能主导自己的婚姻,2756.557,1611047252,16777215,1
677d2619,到时候如果去见烤肉？荷叶能拦着？估计又该说不孝了吧,3057.385,1611047263,16777215,1
4ae44672,对不要相信男人的嘴,4299.838,1611047275,16777215,1
e8413ed5,跟你说干嘛去自己妈家还有错了？,1991.313,1611047304,16777215,1
4ae44672,怀疑只是为了洗白而说的台词,4323.482,1611047312,16777215,1
677d2619,烤肉有心机啊，故意这么说,3123.433,1611047344,16777215,1
c7c6f171,缺少沟通啊，大家都是为对方考虑，误会太多了,2991.674,1611047346,16777215,1
677d2619,烤肉原来安的这种心啊，无形中给荷叶泼脏水,3125.908,1611047389,16777215,1
c6ee9628,看了节目，周围人又说了，可能也反思了吧,3247.195,1611047392,16777215,1
c7c6f171,两个月人都一样，辜负父母误解父母,3033.83,1611047416,16777215,1
677d2619,之前不是说荷叶一直挨骂吗？到这儿变成了荷叶脾气不好？您父子俩演了一出好戏,3147.668,1611047462,16777215,1
e4ea2fff,这俩是来出道吗,7040.882,1611047469,16777215,1
27d36d8c,好马不吃回头草,3891.056,1611047475,16777215,1
a5f7654a,烤肉没有底气说自己的生活自己看着办，因为拿了两亿啊，这两亿也是负担,2906.981,1611047484,16777215,1
677d2619,这男的果然是博主啊，真会演戏,3176.34,1611047512,16777215,1
27d36d8c,做得好,4127.523,1611047544,16777215,1
677d2619,这一会不停的提荷叶做的不好，讲自己多辛苦，打得一手好牌,3181.033,1611047574,16777215,1
677d2619,一辈子的性格怎么可能改，被骂了在这儿装好人,3286.377,1611047681,16777215,1
677d2619,这种顽固性格的人不可能改的，像我爷一样，,3287.657,1611047714,16777215,1
d2c62033,你这样说这老头子不是觉得儿媳妇更不好了吗,2667.489,1611047745,16777215,1
cfbdfb9f,又再卖人设了，这男的好恐怖！,2746.049,1611047814,16777215,1
4cc7db07,什么叫早熟？和男孩子怎么相处这些东西就是要教啊,1864.303,1611047838,16777215,1
60ba6f5,电视剧,4223.503,1611046135,16777215,1
677d2619,看到了吗？你们出钱买房子离婚了没有分给荷叶一毛钱，但是平时给老头的钱有荷叶挣得一半,2679.017,1611046142,16777215,1
c7c6f171,太难伺候了,2018.448,1611046164,16777215,1
3003de5a,哇一直忍不住亲女儿的样子好心疼,1736.823,1611046201,16777215,1
4ae44672,性格很难改,3116.606,1611046248,16777215,1
4ae44672,剧本太假了，之前明说不会复婚现在又搞这出戏,3163.966,1611046310,16777215,1
c7c6f171,谁让你之前骂亲家的,2156.177,1611046333,16777215,1
4ae44672,夫妻生活绝不是两个人的事，就是两家的事，父母怎么做绝对会影响,3192.823,1611046360,16777215,1
c6ee9628,所以是双方礼貌都不到位,2260.893,1611046388,16777215,1
b509de2,你几分呢,2131.818,1611046478,16777215,1
c7c6f171,是因为你之前先对女方说了失礼的话吧,2290.585,1611046490,16777215,1
c7c6f171,是你儿媳，不是你老婆，关你pi事,2304.406,1611046520,16777215,1
b509de2,原来是这种小事啊，糟老头子,2177.47,1611046545,16777215,1
c7c6f171,所以呢，你以为你们家还能娶到天仙嘛,2314.045,1611046551,16777215,1
677d2619,这钱有荷叶的一半，麻烦还给荷叶，连同嫁妆,2718.868,1611046609,16777215,1
68563cd3,说得好,4219.127,1611046683,16777215,1
68563cd3,参加这个又不是来复婚来了,4230.934,1611046694,16777215,1
677d2619,这老头就仗着自己出钱了。天欺负荷叶呗，烤肉从来没去岳母家拜年，岳母还天寄吃的,2770.238,1611046716,16777215,1
c6ee9628,目前看来不太像是这样的，钱是他自己想还给他爸，结果吵架怪爸？,2772.561,1611046724,16777215,1
cfbdfb9f,把娃儿教得这么早熟？,1853.738,1611046751,16777215,1
677d2619,那为什么不孝敬岳母，不给岳母转钱,2818.793,1611046788,16777215,1
677d2619,问题是你给钱就以为自己是老大，欺负荷叶啊,2850.11,1611046841,16777215,1
27d36d8c,太年轻了，才20多,3028.987,1611046950,16777215,1
677d2619,可别了，荷叶是工具吗？为松叶着想当初就不应该那样对荷叶，,2947.902,1611047002,16777215,1
c7c6f171,我越来越不明白这对到底为什么离婚了,2763.85,1611047015,16777215,1
180476e0,你不是最大的原因吗？,2541.61,1611045275,16777215,1
138f6ae2,笑死,1810.222,1611045359,16777215,1
4ae44672,电视剧来了,1931.994,1611045373,16777215,1
cdf8f023,继续被骂吧,2237.218,1611045398,16777215,1
27d36d8c,对的，是不合适而已，并不是谁不好,1631.76,1611045425,16777215,1
a70831ed,有条件的爱不是爱，是交换,2821.01,1611045435,16777215,1
c6ee9628,前面的加一,2918.222,1611045491,16777215,1
6d9614e5,男人至死都是少年？,4034.287,1611045588,16777215,1
c6ee9628,夫妻两个问题更大一点吧,2994.842,1611045605,16777215,1
6d9614e5,失望太多了,4106.715,1611045663,16777215,1
4cc7db07,神奇的是这些奇怪的衣服都前妻买的,376.178,1611045734,16777215,1
9dd83298,夫妻两个的问题，扯到老人身上,3184.381,1611045759,16777215,1
a232e81d,氛围很好啊可以复合的样子好像女主人,6100.992,1611045808,15138834,1
a70831ed,是不是洗白呀,3226.17,1611045845,16777215,1
4ae44672,洗白来的啊,2612.065,1611045851,16777215,1
d4886a07,他是去挑事的么,2679.383,1611045970,16777215,1
6d9614e5,伤害得太深了不敢相信一切承诺,4248.654,1611045997,16777215,1
f19723a,这房子好像机医里曹政奭的家,5145.215,1611046034,16777215,1
439ff44a,烤肉简直在强词夺理瞎扯,2858.817,1611046037,16777215,1
4ae44672,他不喜欢他媳妇对别人不好，别人当然就不会对他好，都是相互的,2930.601,1611046102,16777215,1
75fff272,肯定是要你做了什么对方人家才会这样对你，正常人怎么可能无缘无故这样,2234.931,1611046113,16777215,1
fe59edfa,一句话传达一层味道就变了所以人与人的间隙就是这样产生的啊一定要当面直接聊才不会误解即便是直接聊都有误解哎,4424.261,1611044320,16777215,1
cdfa9ecd,荷叶真的超col，向前看是对的,4161.708,1611044343,16777215,1
677d2619,你要求真多看你儿子什么样吧，你怎么不让他娶仙女啊,2312.233,1611044372,16777215,1
677d2619,你干脆给你儿子找个丑八怪，然后任劳任怨伺候你呗,2314.281,1611044402,16777215,1
db523168,沟通不到位,3205.364,1611044424,16777215,1
fe59edfa,因为最大的问题在你这里。,4579.069,1611044453,16777215,1
677d2619,感觉烤肉就是故意来找他爸说出荷叶的不好，心机男,2337.662,1611044453,16777215,1
cdfa9ecd,经历过的痛苦只有荷叶知道，拒绝是对的，值得更好的，女生一定要向前看别回头,4295.108,1611044476,16777215,1
db151263,我不是善良我觉得如果复婚了他爸根本做不到,3387.241,1611044489,16777215,1
677d2619,就是，大家都是第一次成为一家人，凭什么你不尊重我还得对你点头哈腰,2351.23,1611044501,16777215,1
96c01e42,骗子,3715.983,1611044546,16777215,1
677d2619,不是人家搞得，是你自己说的话做的事，果然什么事都怪别人,2374.1,1611044560,16777215,1
5006f68a,刚生完孩子要怎么起来,2161.749,1611044702,16777215,1
4933506a,啊哈老爸背锅,2094.824,1611044914,16777215,1
84448bf0,这是洗白吗,2445.847,1611044945,16777215,1
677d2619,对啊，所以荷叶妈借钱也凑了嫁妆啊，所以你为什么还是冷眼相待,2472.745,1611045067,16777215,1
33d9da7a,他说不去，谁又知道，后面还有大事,3048.63,1611045117,16777215,1
138f6ae2,23,1203.416,1611045119,16777215,1
90acf3d6,这个我觉得诶，不复婚更合理一些,4065.236,1611045144,16777215,1
c5f1ca95,爸还是讲道理的人第一期是恶剪了吗？,2911.647,1611043476,16777215,1
6d9614e5,你儿子不也是没做吗,2296.232,1611043601,16777215,1
677d2619,所以老爷子不还是这样？被批评了还是不觉得自己有一点的错？,2077.054,1611043616,16777215,1
677d2619,荷叶作为儿媳妇有错，但是这么多人批评你，还是这样？,2080.297,1611043678,16777215,1
5e4b7797,未知全貌不予置评,2694.958,1611043692,16777215,1
ead2ab10,这是什么反转,2975.681,1611043700,16777215,1
db151263,想着还你爸不想着还丈母娘呢,2695.615,1611043725,16777215,1
677d2619,你就是一辈子做主习惯了，批评你就受不了？荷叶天挨骂呢,2103.422,1611043740,16777215,1
ead2ab10,天呐,3082.124,1611043792,16777215,1
677d2619,我靠，这么多人批评你，还是觉得自己一丁点错都没有,2132.009,1611043798,16777215,1
677d2619,打招呼不对你不会提醒吗？怎么的，你是神啊，必须给你下跪啊,2157.695,1611043854,16777215,1
a9c4f18a,来了,27.329,1611043886,16777215,1
db151263,可是你帮了孩子去要求代价，这就是交易了啊,2825.662,1611043891,16777215,1
677d2619,什么都是你，老头你最重要，荷叶刚生完孩子你怎么不体谅,2171.86,1611043894,16777215,1
677d2619,荷叶那么辛苦怀孩子，生孩子，估计你都没来看过，,2174.249,1611043956,16777215,1
20fdf67f,是我就条件反射一个后手肘,952.711,1611043959,16777215,1
5e4b7797,这对夫妻情商不高双方老人的心都伤了,3025.431,1611044012,16777215,1
db151263,说人话了感恩,3032.681,1611044110,16777215,1
5e4b7797,啊有点难过,3183.747,1611044145,16777215,1
677d2619,老头子你怎么不说了？你教烤肉尊重岳母了吗？那荷叶凭什么对你点头哈腰,2271.87,1611044249,16777215,1
7eb5867e,呜真的爆哭,3216.316,1611044261,16777215,1
677d2619,死老头子，你不是很有理吗？,2274.175,1611044266,16777215,1
677d2619,果然我就知道荷叶不会无缘无故不打招呼，你儿子不是什么也没做吗？,2274.772,1611044305,16777215,1
482b9431,啊爸也太惨了,3001.919,1611042640,16777215,1
fc137dcb,我只能说迟来的深情比草贱,3807.399,1611042774,16777215,1
5ed6b509,BGM太诡异了,1928.331,1611042796,16777215,1
6d9614e5,可怕的来了,1687.828,1611042832,16777215,1
56ec4783,狮子王上线,207.807,1611042884,16777215,1
d88b2fde,这不是在暗示女方，,2687.799,1611042900,16777215,1
1cbbc6c4,被骂醒了？,2981.827,1611043036,16777215,1
f6957b02,是不是就是他爸现在觉得我给钱了所以你得尊敬我服侍我？,2769.47,1611043054,16777215,1
fc18b7e8,不喜欢不凑合,4218.795,1611043066,16777215,1
db151263,因为你是作恶的人啊,2084.223,1611043084,16777215,1
1cbbc6c4,但是你也在孩子面前一直骂她妈啊,3005.667,1611043085,16777215,1
6d9614e5,木锁我,1948.986,1611043096,16777215,1
5ed6b509,大反转，哈,2089.171,1611043097,16777215,1
c5f1ca95,16W,2425.147,1611043105,16777215,1
5ed6b509,不说韩国，国内对方父母来了也要打招呼，不能像陌生人,2205.851,1611043244,16777215,1
6d9614e5,现在怎么不会说了,2045.452,1611043315,16777215,1
6d9614e5,人家一个女孩子还被你骂呢,2116.369,1611043395,16777215,1
fe59edfa,我现在觉得这个老公挺可怜的，婚姻生活的各种纠葛绝对不是一方单方面能造成的。,2799.994,1611042013,16777215,1
6d9614e5,受不了,961.826,1611042151,16777215,1
e1db3e14,已经想到前妻吐槽的声音了,201.579,1611042162,9487136,1
fe59edfa,我现在怎么觉得这俩夫妻自身问题才是最大的，鲁莽奉子成婚，各种礼仪不到位，把很多问题也推脱到长辈身上，彼此之间没有爱疏于照顾，长辈来背锅。,2989.662,1611042236,16777215,1
cecbf7e8,说的没错,2091.284,1611042239,16777215,1
89649bdb,我去活该被骂,2198.185,1611042334,16777215,1
409cb95,是很感性的爸呢,1494.761,1611042440,16777215,1
482b9431,孝敬老人不应该吗,2813.609,1611042454,16777215,1
f191f1a1,你啊，就是因为你啊,2533.48,1611040878,16777215,1
f191f1a1,意思就是你别管我家事儿,2778.984,1611041019,16777215,1
64081a72,死老头,2096.033,1611041144,16777215,1
1ab2ad57,还别说真挺模特的,228.467,1611041156,16777215,1
d88b2fde,这男的,973.741,1611041186,16777215,1
d88b2fde,干啥呢,980.479,1611041192,16777215,1
64081a72,大男子主义,2167.048,1611041200,16777215,1
1098df81,笑死了,2347.953,1611041250,16777215,1
ec64930,这个大叔衣服好丑,776.221,1611041268,16777215,1
1ab2ad57,姐太好玩了,412.746,1611041269,16777215,1
6d9614e5,不懂了,211.375,1611041401,16777215,1
5ed6b509,电视剧都不会这么腻歪，哈,958.63,1611041567,16777215,1
49164949,这个人真的把什么都推到别人身上,2753.918,1611041624,16777215,1
fc18b7e8,长辈对孩子是真的好,2983.51,1611041659,16777215,1
f191f1a1,那你为啥反对？,2107.667,1611040653,16777215,1
64081a72,哈野兽人,218.185,1611040830,16777215,1
