Sender,DmContent,AppearTime,SendTime,FontColor,DmType
3e15df16,和康南家挺像的,1636.484,1611069473,16777215,1
777ea398,不要那么恶意揣测,4712.126,1611069617,16777215,1
3e15df16,为什么要跟你说，又不是你生的，你个老不死，,2011.236,1611069851,16777215,1
5ca7dd7e,复婚了？,7027.589,1611068518,16777215,1
3e15df16,刚起床喝个咖啡就天黑了,1012.968,1611068849,16777215,1
caf82fa8,这是新的吗？,7032.959,1611067536,16777215,1
1757a4c4,姐都知道你不想让她来还硬着头皮去干吗找罪受吗无语,2287.46,1611067742,16777215,1
1757a4c4,怎么说此男为维护自己形象现在正在作秀呢,2304.061,1611067789,16777215,1
5ca7dd7e,自爆,6028.44,1611067849,16777215,1
eac9fe3c,两个人的问题非要扯到两家长上。,4045.749,1611068019,16777215,1
d8ca1e34,哈烤肉,7010.739,1611068055,16777215,1
eac9fe3c,可以够理性,4205.308,1611068179,16777215,1
caf82fa8,这边又是他爸的问题了，反正从头到尾他一点问题都没有,3991.041,1611066611,16777215,1
eac9fe3c,这是真白眼狼,2770.725,1611066675,16777215,1
caf82fa8,说得好,4099.928,1611066720,16777215,1
caf82fa8,这才几个月就又想复婚？而且还和别人搞了3个月,4146.475,1611066826,16777215,1
eac9fe3c,我感觉一直都不是他爸的问题,2991.568,1611066897,16777215,1
254bca7c,因为啥你不知道吗,2067.499,1611066995,16777215,1
eac9fe3c,只有片面接触没有礼貌就说0分我觉得很正常,3108.087,1611067013,16777215,1
254bca7c,他还觉着自己忍了很多还委屈上了,2188.919,1611067144,16777215,1
eac9fe3c,一个当过社长的人。哎。死孩子,3304.229,1611067252,16777215,1
caf82fa8,就是想通过节目装,4703.335,1611067437,16777215,1
dc9d42d8,估计是干预的有点多,2848.202,1611062761,16777215,1
c6e4bbfb,为什么要配这个BGM啊？她妈只是问一下啊，又不是逼问。BGM搞事情啊,4379.989,1611063091,16777215,1
c65fc672,我是不是来错片场了，这里怕不是同床异梦吧,1009.709,1611063191,16777215,1
108c4873,妈欣慰的表情哈,4447.989,1611063318,16777215,1
c6e4bbfb,主持人是被剧本了吗？女方和妈受过伤，男方道歉了就一定得回去？,4483.304,1611063332,16777215,1
4c9ddc6d,现在是从电视上从周边的人知道自己为人过分了，才开始反省了,3095.573,1611063794,16777215,1
cb1c7039,如果当时没有这两亿，真的住在地下室，难道不会因为没有钱产生矛盾，最后离婚吗？现在是说离婚都怪这两亿咯？,2865.917,1611063797,16777215,1
d3212590,高丽都亡了啊！,2200.19,1611064011,16777215,1
ee17cfda,他真的好爱她,1673.417,1611064166,16777215,1
b12dca08,所以搞得两家都不愉快的事都是沟通不到位,2989.473,1611064169,16777215,1
5ca7dd7e,真心希望他俩别复婚,3809.937,1611064260,16777215,1
5ca7dd7e,我真的服了这男的，好会演啊,4033.905,1611064484,16777215,1
5ca7dd7e,真帅,4102.47,1611064553,16777215,1
5ca7dd7e,这男的给荷叶太多失望了,4139.018,1611064589,16777215,1
4e0954ba,现在压力全部转移给荷叶了,4090.869,1611064727,16777215,1
5ca7dd7e,不喜欢就别将就,4324.348,1611064775,16777215,1
5ca7dd7e,可能是想复婚之后什么钱都不用还了吧,4469.152,1611064919,16777215,1
4e0954ba,为孩子捆绑的婚姻注定备受煎熬,4346.542,1611064983,16777215,1
4c9ddc6d,看着就是以前啊,7034.744,1611064983,16777215,1
b12dca08,他俩需要离婚冷静期,4064.317,1611065295,16777215,1
d8ca1e34,太好哭了，原来爸也是为了子女的人，希望误会都可以解除,3284.926,1611065363,16777215,1
b12dca08,有多少爱可以重来,4118.756,1611065365,16777215,1
245f920f,有点甜怎么回事,782.104,1611065399,16777215,1
20fdf67f,都是负责任的好父母啊只是做对方的伴侣不合适现在这样做家人也挺好,1530.214,1611065548,16777215,1
36c611e,假如爱有天意的插曲,4792.374,1611065650,16777215,1
d876019a,紧跟时事,4049.759,1611065845,16777215,1
caf82fa8,这个烤肉有毒,3483.764,1611066091,16777215,1
eac9fe3c,我觉得礼貌还是要有如果是真这样就这女的问题了,2211.937,1611066116,16777215,1
eac9fe3c,爸没错啊,2476.11,1611066381,16777215,1
a232e81d,这俩氛围好,5078.803,1611066504,15138834,1
caf82fa8,反正把自己摘出来了,3939.696,1611066560,16777215,1
c6e4bbfb,不对的是你！你比你爸问题严重多了！,3864.027,1611061602,16777215,1
ee987c1a,这对更像是夫妻吵架一气之下离婚的冲动离婚,4971.658,1611061662,16777215,1
156d46b3,哇！,4206.572,1611061900,16777215,1
156d46b3,向姐学习，酷,4206.572,1611061915,16777215,1
ee987c1a,这么甜后面的反转会很大吗离婚的冲突,5475.586,1611062342,16777215,1
5ca7dd7e,大魔王来了,1994.332,1611062422,16777215,1
156d46b3,感觉这男的在推卸责任，把责任推到他爸身上,2591.383,1611060589,16777215,1
156d46b3,这是离婚的原因？！,2675.852,1611060668,16777215,1
c6e4bbfb,他真的好懂怎么在镜头前说话，但就是平时不说，留到镜头说。,3674.933,1611060998,16777215,1
117dcb51,演技好,3752.244,1611061008,16777215,1
b6cbbdff,怎么感觉像妈一样一直念叨好噢,1648.722,1611061111,16777215,1
5ca7dd7e,这世上竟然有这么奇怪的衣服,202.169,1611061127,16777215,1
117dcb51,荷叶看得明白,3878.336,1611061135,16777215,1
7e5ddeb4,哈这就是慌了，谁要问你这个了,6019.367,1611061265,16777215,1
cdd8a400,爱会让一个人改变，烤肉父亲就是因为爱孙女爱儿子所以才会改变,3871.226,1611061361,16777215,1
e5e0bec9,爷也说了之前被别人讲了，可能也理解到了,3001.186,1611059649,16777215,1
cdd8a400,双方父母拿钱了就肯定得参与其中，对夫妻关系不是什么好事,2747.22,1611059650,16777215,1
7e5ddeb4,嗯，不能都靠一张嘴,4252.242,1611059779,16777215,1
cdd8a400,他爸真的很爱他,2810.642,1611059805,16777215,1
e5e0bec9,爷也挺可怜的,3186.348,1611059834,16777215,1
c6e4bbfb,好爸不等于好丈夫啊！,3503.061,1611059985,16777215,1
7e5ddeb4,烤肉真的是很适合做节目,4553.98,1611060024,16777215,1
cdd8a400,他爸已经是80岁的老人了,2974.802,1611060114,16777215,1
7e5ddeb4,这么看荷叶是借节目明白了更多，烤肉是借节目想刷新人设,4673.133,1611060119,16777215,1
d0069f19,吓人,1895.038,1611060328,16777215,1
cdd8a400,他爸真的很爱儿子,3133.22,1611060454,16777215,1
c6e4bbfb,爸虽然对荷叶不好，但至少真，烤肉好虚伪,3660.885,1611060533,16777215,1
c6e4bbfb,别复婚！问题是烤肉，不是他爸！,2970.249,1611058706,16777215,1
7e5ddeb4,同意闺蜜,3480.316,1611058750,16777215,1
7e5ddeb4,就自己两个人看吧，千万别把这些都塞在为了孩子这一条上,3519.336,1611058804,16777215,1
7e5ddeb4,男生真的不如女生干脆,3639.827,1611058924,16777215,1
ee987c1a,不复婚，住一起共同抚养,3574.256,1611059045,16777215,1
cdd8a400,结婚钱全是人老爷子出的,2512.266,1611059056,16777215,1
7e5ddeb4,都这么谈过，却还是离婚了,3835.981,1611059089,16777215,1
c6e4bbfb,舆论的力量太强大了。老爷子总算醒悟了。,3001.301,1611059098,16777215,1
cdd8a400,震惊！虽然两亲家关系不好但是都无法接受离婚,2525.719,1611059314,16777215,1
c6e4bbfb,烤肉他早干嘛了？离婚都七个月，他还有三个月在交男朋友！父亲错不大，是烤肉的问题,3197.768,1611059334,16777215,1
cdd8a400,烤肉是挺孝顺的,2616.664,1611059350,16777215,1
7e5ddeb4,哇这么一弄不会显得女生很不懂事？,3951.254,1611059390,16777215,1
c6e4bbfb,老爷子没那么坏，但荷叶做错啥了？别复婚，不是因为公，而是因为烤肉,3200.688,1611059403,16777215,1
cdd8a400,烦死了，从头到尾说洗白的是不是都是同一个人哪,2644.666,1611059463,16777215,1
7e5ddeb4,支持,4118.647,1611059524,16777215,1
e5e0bec9,太伤人了，如果当时想得多一点，倒不会有现在的这些不开心,2892.931,1611059541,16777215,1
7e5ddeb4,荷叶好争取抚养权吧,4148.9,1611059548,16777215,1
c6e4bbfb,那女方给的五千万就不用还给女方了吗？,2702.953,1611057789,16777215,1
7e5ddeb4,这个婚可千万别复,2701.292,1611057796,16777215,1
503a4786,爸想开了？,2978.821,1611057864,16777215,1
c6e4bbfb,我好心疼荷叶和这个爷啊，原来渣的只有烤肉,2734.703,1611057896,16777215,1
ee987c1a,还是在于表达方式吧,2874.645,1611057973,16777215,1
8352ee00,太年轻了,5519.054,1611057981,16777215,1
c6e4bbfb,明是烤肉的问题，却让父亲和荷叶互相伤害,2779.291,1611058075,16777215,1
7e5ddeb4,可别了,2959.714,1611058091,16777215,1
c3c9e80b,哈这狗怎么那么憨,6949.491,1611058139,16777215,1
7e5ddeb4,这段说的也太放送节目用语了,2981.265,1611058146,16777215,1
ee987c1a,太年轻的时候思考不到父母的心，反而任性而为,3064.571,1611058163,16777215,1
c6e4bbfb,但是，女方净身出户，女方出的五千万没还给女方啊！,2809.581,1611058259,16777215,1
f1a2c5ff,小姑子好可爱肉嘟,6037.721,1611058318,16777215,1
31c86258,演员,3990.144,1611058342,16777215,1
c6e4bbfb,离婚都是别人的问题？荷叶岳母爸，都被他怪了一遍,2858.059,1611058373,16777215,1
c6e4bbfb,但这些话他早就可以说了，非等到今天，等到有镜头的时候说,2859.622,1611058422,16777215,1
7e5ddeb4,不是，也没有问过女生，为什么就说女生恐惧呢,3239.388,1611058498,16777215,1
ee987c1a,也可能是剪辑问题。把部分话剪出来,3217.362,1611058523,16777215,1
ee987c1a,应该也是周围的人的话让老头开始反思了,3290.672,1611058596,16777215,1
c6e4bbfb,题外话，他爸后面有汉字的家庭医学大事典,2967.77,1611058654,16777215,1
cdd8a400,这是活在哪个年代,2202.731,1611056882,16777215,1
cdd8a400,一个巴掌拍不响，只能说公和媳妇2个人都对彼此伤心,2223.632,1611056957,16777215,1
aa2e7b1a,如果你爸刚才那么和你交流也算扯着嗓子的话。那你可是真的高端绿茶,3907.092,1611056987,16777215,1
cdd8a400,长得好看而且还是天然的，这在韩国是天大的优点好嘛,2311.612,1611057082,16777215,1
c6e4bbfb,这个烤肉真的好心机啊，这样网友又会骂爸又会骂荷叶，反而洗白烤肉,2662.431,1611057101,16777215,1
cdd8a400,烤肉逗死我了,2344.467,1611057139,16777215,1
d8fce450,这男的太假啦,4567.747,1611057155,16777215,1
c6e4bbfb,这个叫孝顺？我都开始心疼老头子了。边气老婆边气爹，烤肉太不是人了,2659.214,1611057224,16777215,1
c6e4bbfb,这个烤肉太可怕了,2659.902,1611057240,16777215,1
414caf5b,全靠嘴忽悠，女的脑子呢,3721.513,1611057270,16777215,1
503a4786,打太极是和这种自负老人说话的策略，先充分肯定。我们也可以学一学,2610.053,1611057327,16777215,1
cdd8a400,他俩最大的问题就是结婚时经济不独立，双方父母参与度太高了,2417.587,1611057332,16777215,1
c6e4bbfb,在父亲面前说媳妇坏话，在媳妇面前说父亲坏话，烤肉有病吧,2677.156,1611057398,16777215,1
503a4786,估计家里是真的没钱,2703.053,1611057422,16777215,1
503a4786,这个很真实，国内很多人都是这样吵架,2720.573,1611057440,16777215,1
cdd8a400,80岁的人啦，这可能是棺材本儿的钱啦,2469.541,1611057443,16777215,1
cdd8a400,能看出来父亲很爱儿子,2471.433,1611057459,16777215,1
c6e4bbfb,父亲有问题，老婆有问题，就你没问题？,2677.0,1611057485,16777215,1
503a4786,哈我也觉得，结婚买房不应该双方父母出钱。虽然身为女生说这种话被很多人笑话过。,2742.983,1611057518,16777215,1
503a4786,是的，但是这种话不应该现在说，应该买房之前说。我是充分做好了以后租房住的准备的，即便我爸妈或者男方爸妈非要出钱也不可以。但是事后诸葛亮就太虚伪了,2752.324,1611057599,16777215,1
503a4786,应该是老人觉得自己买了房，不太看得起女方家，所以礼仪方面也希望自己是家庭绝对的主角,2777.183,1611057654,16777215,1
c6e4bbfb,这歌烤肉想说的是荷叶爸丈母娘都有问题，我没问题,2698.418,1611057720,16777215,1
d62580dc,深怀疑这哥是gay。,360.513,1611057740,16777215,1
c6e4bbfb,狗的问题怪儿媳妇？,2184.624,1611055974,16777215,1
f2be1d16,这男的真坏啊！说到现在就他自己一点错没有！,3137.513,1611055998,16777215,1
c6e4bbfb,活该被骂，这不是传统，是迂腐,2200.299,1611056006,16777215,1
3c4d971f,笑疯了,973.825,1611056060,16777215,1
cecbf7e8,不要相信他,3881.15,1611056088,16777215,1
cecbf7e8,荷叶，干的漂亮,4103.7,1611056169,16777215,1
dd85baf1,真渣，怪东怪襾,2843.739,1611056191,16777215,1
c6e4bbfb,替爷说话的那个，如果你公骂你爹妈，你能不生气？,2201.692,1611056205,16777215,1
f1a2c5ff,冠冕堂皇,3730.241,1611056237,16777215,1
81639611,他的意识是他爸因为给了钱，所有点优越感的意思吗？,2881.768,1611056272,16777215,1
2c67e289,过去没有幸福过的婚姻是山,4338.277,1611056284,16777215,1
7e5ddeb4,真的帅气,1538.466,1611056291,16777215,1
81639611,可能他爸就是那种性格呢？给不给钱都对儿媳妇这样要求,2915.149,1611056306,16777215,1
81639611,但是我觉得自己没钱不要结婚生孩子是真的,2938.468,1611056329,16777215,1
c6e4bbfb,还有指责荷叶的？你公相见礼上就骂你爹妈，你会对你公好,2226.412,1611056332,16777215,1
8352ee00,想能理解的，爸说话不好听，他习惯了，不觉得有什么,3973.347,1611056360,16777215,1
81639611,感觉父亲就是那个年代的想法，也没有那么坏啊,2998.671,1611056394,16777215,1
c6e4bbfb,哈，自己儿子都没做好,2262.788,1611056411,16777215,1
7e5ddeb4,通过这几次能说开了真好,1667.66,1611056420,16777215,1
cecbf7e8,至今丈母娘多首饰钱和彩礼不还，还装不知道,4413.886,1611056436,16777215,1
8352ee00,感觉应该先分居，后面再考虑离婚,4056.497,1611056443,16777215,1
7e5ddeb4,是要迎来生气了吗？,1679.448,1611056447,16777215,1
c6e4bbfb,烤肉会对岳母问好是因为岳母把他当儿子，公在相见礼上骂了荷叶的爹妈，荷叶能不生气？,2304.776,1611056568,16777215,1
cecbf7e8,这男的是为了放送量吧,4538.046,1611056582,16777215,1
cdd8a400,烤肉也挺难的，怎么做都是错，幸好父亲还算爱他,2109.472,1611056718,16777215,1
d8fce450,荷叶这是伤透了心，女人一旦放手了那是真的伤透心啦。,4252.188,1611056758,16777215,1
503a4786,原来还笑嘻点头了啊？我以为真的没有打招呼呢还想不至于吧。这爸这么严格吗,2158.107,1611056777,16777215,1
cdd8a400,到了这个年龄想改变老爷子的想法很难,2136.172,1611056778,16777215,1
f2be1d16,哈不知道咋吃了,5413.801,1611056790,16777215,1
c6e4bbfb,我也觉得，烤肉比他爸问题大,2550.052,1611056822,16777215,1
b1261e31,这一对我其实还挺喜欢,4745.773,1611056846,16777215,1
7e5ddeb4,边上这个柜子很大逃脱了误,1995.498,1611056849,16777215,1
503a4786,她打招呼了啊，爸不是说了吗，笑嘻点头了，他觉得怎么能这么打招呼,2209.755,1611056854,16777215,1
cecbf7e8,荷叶不要复婚，烤肉太假了,2866.793,1611055073,16777215,1
aa2e7b1a,所以老爷子哪里不善良了,3402.65,1611055136,16777215,1
d36adc9b,哈这傻狗为什么嘴里总咬个玩具,6944.715,1611055141,16777215,1
c6e4bbfb,为什么要跟你说啊？,2012.508,1611055148,16777215,1
c6e4bbfb,你训儿子就行，别训荷叶,2042.104,1611055207,16777215,1
8a3f4900,col,3719.339,1611055214,16777215,1
d36adc9b,这对感觉是专门来撕的,6980.983,1611055232,16777215,1
c6e4bbfb,一开始以为离婚全是爷的错，但现在才发现爷也有错，烤肉错更多,2080.331,1611055270,16777215,1
3c4d971f,我手机铃声，哈,219.225,1611055299,16777215,1
d36adc9b,以前拍的吧,7041.282,1611055311,16777215,1
8352ee00,这个男的又在甩锅，自己一点事情没有。,2771.851,1611055317,16777215,1
cecbf7e8,真实情况就是烤肉自己没担当，让大家给他背锅,3213.737,1611055338,16777215,1
c6e4bbfb,韩国网友果然不出所料哈,2080.331,1611055355,16777215,1
8352ee00,和爸关系不大。就是烤肉自己的问题啊。对你好，你反而觉得是绑架，白眼狼,2811.945,1611055388,16777215,1
b1261e31,在日韩这种都很正常,1869.251,1611055487,16777215,1
d2b9ba65,在婚姻中受到太大伤害已经彻底绝望才提的离婚吧荷叶,4216.874,1611055518,16777215,1
f6fccdee,一直在打太极的感觉呢,2600.835,1611055532,16777215,1
c6e4bbfb,这烤肉还在笑？虽然他爸有问题，但他也并不孝顺啊！,2082.452,1611055541,16777215,1
7e5ddeb4,哈好优雅,923.227,1611055548,16777215,1
c6e4bbfb,虽然他爸有问题，但他也并不孝顺啊！这烤肉还在笑？,2086.555,1611055552,16777215,1
a27447c,野兽男,206.569,1611055583,16777215,1
c14de909,心灰意冷才会离婚，不是嘴上说，真想复婚还得看行动,4129.841,1611055612,16777215,1
c6e4bbfb,爸被网友骂，儿子在笑？他爸是有问题，更有问题的是他吧？,2078.771,1611055640,16777215,1
c6e4bbfb,烤肉好自私啊，还让老父亲背锅,2100.692,1611055675,16777215,1
cecbf7e8,别信他,3788.35,1611055702,16777215,1
156d46b3,这些屁事,2279.367,1611055763,16777215,1
c6e4bbfb,谁让你之前骂亲家的？,2158.241,1611055802,16777215,1
7e5ddeb4,哈是不是如果不是在拍姐就张嘴骂了,1163.825,1611055804,16777215,1
c6e4bbfb,阿西八,1687.584,1611054100,16777215,1
c6e4bbfb,血压升高预警,1695.3,1611054107,16777215,1
6a287d10,大家不要高估自己的力量以为自己写几个评论就会动摇别人的人生荷叶一直清醒着了,4122.408,1611054115,16777215,1
b339c98e,是事实的话也可以沟通的,2700.413,1611054129,16777215,1
c6e4bbfb,这是荷叶的房子吧？看着不像爷的房子,1728.106,1611054143,16777215,1
aeb42895,所以生孩子不是那么简单的事情，荷叶是这辈子被孩子绑住了，郑爽以后也是，无论她愿不愿意,4039.828,1611054146,16777215,1
c6e4bbfb,好心疼啊，她不是不爱女儿，只是不敢表达，怕舍不得,1762.964,1611054171,16777215,1
c6e4bbfb,D社,1794.52,1611054201,16777215,1
c6e4bbfb,哈，这对母女相处太好玩了,1808.812,1611054212,16777215,1
156d46b3,这位大哥的审美。,202.417,1611054318,16777215,1
6a287d10,媛熙的话翻译错了是就算我老爷不在你们的关系里，也会为你们的幸福祈祷,4315.007,1611054321,16777215,1
d2b9ba65,荷叶这么怕这前公肯定不止钱方面原因,2811.036,1611054334,16777215,1
aa2e7b1a,所以他爸替他交了两个亿，他每个月给他爸一点，倒成了他爸的不是了。这白眼狼,2751.003,1611054354,16777215,1
aeb42895,她是完全死心了之后才离婚的吧,4270.219,1611054376,16777215,1
42cecb2c,我觉得可以严重到离婚，以后也会出现相同的问题的,3483.784,1611054376,16777215,5
42cecb2c,到时候吵得更凶，对孩子会更不好,3483.784,1611054407,16777215,5
2c67e289,像是要说清楚错不在他家,2722.64,1611054414,16777215,1
aeb42895,说荷叶是山，不如说过去的崔烤肉成为了现在的崔烤肉的山,4314.944,1611054421,16777215,1
c6e4bbfb,这不是荷叶把松叶教的那么早熟，她只是在问，是烤肉把松叶教的早熟的吧,1863.574,1611054423,16777215,1
64783454,很多时候环境改变人才会改变，才会清醒,4045.542,1611054445,16777215,1
6a287d10,大家真的不要以为自己打几个字能动摇别人什么看了评论才知道太搞笑了,4460.563,1611054466,16777215,1
d2b9ba65,荷叶为啥那么怕前公呢烤肉倒是一点也不怕前丈母娘,3006.769,1611054539,16777215,1
c6e4bbfb,蔚山！建厚娜恩jinu的城市！,1952.512,1611054554,16777215,1
c6e4bbfb,建厚娜恩jinu的城市！蔚山！,1959.632,1611054563,16777215,1
c6e4bbfb,因为建厚娜恩jinu，特别喜欢蔚山！,1952.953,1611054648,16777215,1
f1a2c5ff,烤肉就是祸害,3111.214,1611054691,16777215,1
cecbf7e8,荷叶不要复婚,2563.775,1611054721,16777215,1
d6b0b123,离婚原因绝对不是钱，也不是爷的问题，肯定这男的有原因。,2920.318,1611054747,9487136,1
cacce063,为什么一定要告诉你,2005.269,1611054768,16777215,1
cecbf7e8,说这些干啥，洗白？,2640.66,1611054812,16777215,1
cecbf7e8,烤肉这只狡猾的狐狸,2680.425,1611054867,16777215,1
ceacfb87,男的达成为他爸洗白了,4284.338,1611054911,16777215,1
aa2e7b1a,这男的真的贱，老爷子要沟通他又来这一套,3232.727,1611054931,16777215,1
cecbf7e8,烤肉这个虚伪的家伙，侧面想搞臭荷叶吧,2729.15,1611054938,16777215,1
aa2e7b1a,怕不是在女方那又说老爸不愿意沟通,3232.727,1611054942,16777215,1
ceacfb87,阿爸真相了,2588.261,1611053215,16777215,1
6a287d10,弹幕真是杠精多不改又说死性不改大男人主义认错又说是假装没诚意做啥都是错了？,3094.825,1611053271,16777215,1
d36adc9b,这对真的好甜啊,5213.651,1611053333,16777215,1
8192d385,这微表情绝了,4420.654,1611053344,16777215,1
c14de909,不要忘记当初的痛苦，不要重蹈覆辙,3815.017,1611053349,16777215,1
8192d385,shake,4480.174,1611053409,16777215,1
6a287d10,爷和外婆其实想的都一样不要让孙女流眼泪伤心,3209.428,1611053462,16777215,1
6a287d10,真的看老人自身条件也没有很好婚房的钱估计也是来之不易,3285.119,1611053583,16777215,1
d36adc9b,这不是一个梗吗吃饭声音大,5401.212,1611053593,16777215,1
cecbf7e8,骂荷叶的和骂老头的是同一伙人,2221.289,1611053608,16777215,1
6a287d10,弹幕太多人性本恶了老人都认错了还想咋滴,3290.751,1611053636,16777215,1
6a287d10,真的不能怪老人,3306.537,1611053665,16777215,1
892a537c,突然觉得不是爸的问题是这个男人的问题,3247.552,1611053732,16777215,1
ecd4e5f6,哈可以,204.37,1611053766,16777215,1
ecd4e5f6,哈旷野男孩,234.305,1611053796,16777215,1
cecbf7e8,谈结婚的时候就闹掰了，心里有气才不问好啊。是我也不会问。因为一开始你就没尊重我啊,2310.548,1611053822,16777215,1
c6e4bbfb,这对夫妻都很善良，男方女方都是,1474.727,1611053860,16777215,1
6a287d10,所以烤肉不是没有分房给荷叶房本来就是租的烤肉也没有任何好处,3335.508,1611053864,16777215,1
6a287d10,就是误会了老爷也说了自己说话冲了就是语气问题吧,3351.294,1611053909,16777215,1
892a537c,唯一个不像剧本的韩综,3410.194,1611053918,16777215,1
6a287d10,所以还是年轻人自己的问题,3476.18,1611053982,16777215,1
64783454,骗你了？这么多话,3723.409,1611053992,16777215,1
c6e4bbfb,这对男生女生都很善良,1646.043,1611054067,16777215,1
b76ab188,巧舌如簧,3716.74,1611054087,16777215,1
d9cfa7dc,啊难受,3083.39,1611054092,16777215,1
105b24e7,姐太酷了,767.911,1611052349,16777215,1
958f1908,哇这男的绝了,2692.5,1611052399,16777215,1
64783454,其实问题就是双方缺少沟通，和父母也缺少沟通,3039.502,1611052401,16777215,1
6a287d10,所以我觉得一直以来都是烤肉没做好然后各种找父亲岳母背锅说是家庭原因,2690.431,1611052489,16777215,1
d549bb4f,这男的又油腻又猥琐,981.659,1611052549,16777215,1
64783454,结婚时期两人的相处模式只有她们知道，不予评价，也不偏帮,3153.981,1611052588,16777215,1
958f1908,烤肉在婚后也没好照顾荷叶啊家长又不住在一起,2858.303,1611052595,16777215,1
6a287d10,所以前面骂老人家的不能太片面离婚各种原因都有并不是老人家造成的,2806.569,1611052659,16777215,1
958f1908,能不能直接说原因,2925.887,1611052673,16777215,1
6a287d10,大家也不要太片面老人家只是不满意荷叶采访的时候说了两句大家又不是天生活在一起哪有一直欺负荷叶,2853.417,1611052781,16777215,1
6a287d10,老人家也是可怜,2865.706,1611052809,16777215,1
958f1908,这两离婚也不全是父母的原因吧,3073.044,1611052831,16777215,1
2bc3f8ce,这男的打这一手好牌一句的都有心机,3239.295,1611052847,16777215,1
a338b9fd,前面的是魔鬼吗？,3781.233,1611052868,16777215,1
958f1908,你爸都没觉得暴脾气,3123.711,1611052920,16777215,1
958f1908,果然这男的,3127.977,1611052938,16777215,1
d36adc9b,两只狗好憨呐,4856.918,1611052957,16777215,1
6a287d10,前面说利用荷叶是工具人的也不要太过分老人家只是想孙女幸福没想着利用任何人,2973.311,1611052981,16777215,1
6a287d10,老人家还挺可怜,2981.076,1611052999,16777215,1
6a287d10,真的父母不是最大问题奉子成婚结婚太早不成熟是问题,2995.412,1611053051,16777215,1
6a287d10,那是采访时候一次半次编辑出来的效果哪有一直骂,3010.089,1611053123,16777215,1
e529e218,该面对的就得面对,3161.669,1611051400,16777215,1
c6e4bbfb,但我觉得很甜啊，直女和深情男的故事,999.107,1611051434,16777215,1
6a287d10,大家不要看错了不在父亲错在偏颇父亲的烤肉,2547.326,1611051449,16777215,1
892a537c,赶紧断绝关系吧,1693.822,1611051459,16777215,1
e529e218,其实就是缺乏沟通，双方都有自身的问题！,3271.229,1611051554,16777215,1
c2659ff8,哈第一次那个,5992.533,1611051600,16777215,1
d36adc9b,可是为什么岳母说相见礼的时候对方说话难听呢,3346.47,1611051649,16777215,1
e529e218,这么看不能全怪爸，荷叶做的也有欠妥的地方！,3311.929,1611051653,16777215,1
75298798,李天空这家人好单纯啊,6428.619,1611051762,16777215,1
ae798b94,这男的不粘锅啊,3123.192,1611051780,16777215,1
773dc906,在说什么？离婚是因为爸买了房子？,2913.129,1611051802,16777215,1
773dc906,离婚的决定不是这个爸做的,3060.085,1611051924,16777215,1
c14de909,当时就是没钱没话语权,2910.35,1611051949,16777215,1
958f1908,这男的不行,2348.009,1611052006,16777215,1
d549bb4f,每次衣服都很夸张，很油腻，很难看,234.237,1611052046,16777215,1
67a49798,荷叶太漂亮啦,7022.911,1611052115,16777215,1
